Domanda,Testo,Stralcio,Repertorio
,," Si tratta di un tipo di rimprovero suddiviso in quattro fasi:
1. descrizione del comportamento indesiderabile
2. spiegazione del perché tale comportamento sia indesiderabile
3. suggerimento di un comportamento alternativo
4. indicazione del vantaggio che deriva dall'uso del comportamento
adeguato.",SPECIFICAZIONE 
,"Lo scopo del ricorrere alle conseguenze logiche è quello di rendere l'alunno responsabile per le le proprie azioni. Diversamente dalle normali punizioni, che spesso non sono direttamente collegate al comportamento scorretto, le conseguenze logiche sono, come il termine stesso suggerisce, in qualche modo direttamente collegate ad esso. Se la classe è a conoscenza delle logiche conseguenze dell'infrangere le regole concordate e del violare i diritti altrui, sarà più facile costruire negli alunni un senso di responsabilità personale. La conseguenza negativa più studiata, relativamente al bambino con ADHD, è il costo della risposta. Per poter attuare questa procedura è necessario che ogni mattina, all'inizio delle lezioni, al bambino vengano messi a disposizione un certo numero di punti premio, di bollini o di gettoni. Prima di applicare la procedura verrà costruito, assieme al
bambino, un menu di ricompense che gli verranno concesse in base ai punti che riuscirà a conservare e a guadagnare comportandosi in modo corretto. Si potrà utilizzare al riguardo un apposito «tesserino raccogli punti».",Lo scopo del ricorrere alle conseguenze logiche è quello di rendere l'alunno responsabile per le le proprie azioni.,SANCIRE 
,,"Diversamente dalle normali punizioni, che spesso non sono direttamente collegate al comportamento scorretto, le conseguenze logiche sono, come il termine stesso suggerisce, in qualche modo direttamente collegate ad esso.",SANCIRE 
,,"Se la classe è a conoscenza delle logiche conseguenze dell'infrangere le regole concordate e del violare i diritti altrui, sarà più facile costruire negli alunni un senso di responsabilità personale.",PREVISIONE 
,,"La conseguenza negativa più studiata, relativamente al bambino con ADHD, è il costo della risposta",COMMENTO 
,,"Per poter attuare questa procedura è necessario che ogni mattina, all'inizio delle lezioni, al bambino vengano messi a disposizione un certo numero di punti premio, di bollini o di gettoni. Prima di applicare la procedura verrà costruito, assieme al bambino, un menu di ricompense che gli verranno concesse in base ai punti che riuscirà a conservare e a guadagnare comportandosi in modo corretto. Si potrà utilizzare al riguardo un apposito «tesserino raccogli punti».",RIFERIMENTO OBIETTIVO 
,"L'intervento implica la somministrazione della penalità (la perdita di punti o di bollini) nel momento in cui si verificano determinati comportamenti indesiderabili precedentemente specificati, quali, ad esempio, gridare, disturbare gli altri, insultare un compagno, correre nelle aule. Alla fine della mattinata si farà il conto dei punti o bollini e verrà concessa al bambino una gratificazione in base ai punti. Si potrà scegliere, a seconda dei casi, una ricompensa che il bambino riceverà a casa dai genitori, oppure qualcosa che gli verrà concessa a scuola nel pomeriggio (in caso di lezioni pomeridiane) o la mattinata successiva.",L'intervento implica la somministrazione della penalità (la perdita di punti o di bollini) nel momento in cui si verificano determinati comportamenti indesiderabili precedentemente specificat,DESCRIZIONE 
,,"i, quali, ad esempio, gridare, disturbare gli altri, insultare un compagno, correre nelle aule. ",SPECIFICAZIONE 
,,"Alla fine della mattinata si farà il conto dei punti o bollini e verrà concessa al bambino una gratificazione in base ai punti. Si potrà scegliere, a seconda dei casi, una ricompensa che il bambino riceverà a casa dai genitori, oppure qualcosa che gli verrà concessa a scuola nel pomeriggio (in caso di lezioni pomeridiane) o la mattinata successiva. ",DICHIARAZIONE DI INTENTI 
,"Ad ogni modo è importante che al bambino venga consegnato un cartoncino con indicazione della ricompensa guadagnata, in modo da dargli subito qualcosa di concreto che gli indichi il premio guadagnato. Il bambino con ADHD spesso ha una tale difficoltà a guadagnarsi delle ricompense, che, una volta avuta a disposizione una certa quantità di punti premio, avrà una notevole motivazione a non perderli. Naturalmente si dovrà fare in modo di concedere al bambino un numero di punti sufficiente perché alla fine dell'orario scolastico gli rimanga qualcosa. Qualora i punti siano troppo pochi per accedere a una ricompensa in giornata, potrà metterli da parte per avere una ricompensa maggiore il giorno dopo. ","Ad ogni modo è importante che al bambino venga consegnato un cartoncino con indicazione della ricompensa guadagnata, in modo da dargli subito qualcosa di concreto che gli indichi il premio guadagnato",PRESCRIZIONE
,,"Il bambino con ADHD spesso ha una tale difficoltà a guadagnarsi delle ricompense, che, una volta avuta a disposizione una certa quantità di punti premio, avrà una notevole motivazione a non perderli.",PREVISIONE
,,Naturalmente si dovrà fare in modo di concedere al bambino un numero di punti sufficiente perché alla fine dell'orario scolastico gli rimanga qualcosa.,PRESCRIZIONE 
,,"Qualora i punti siano troppo pochi per accedere a una ricompensa in giornata, potrà metterli da parte per avere una ricompensa maggiore il giorno dopo. ",POSSIBILITA 
,"Il costo della risposta è generalmente visto dagli insegnanti come efficace e facile da somministrare. Come accade con le altre conseguenze negative, il problema che si pone con il costo della risposta è che l'unico riscontro che l'alunno riceve riguarda comportamenti inadeguati. Per cui, come menzionato precedentemente, sarà necessario usare le conseguenze negative per un comportamento inappropriato contemporaneamente con conseguenze positive per il comportamento appropriato. ", Il costo della risposta è generalmente visto dagli insegnanti come efficace e facile da somministrare.,SANCIRE 
,,"Come accade con le altre conseguenze negative, il problema che si pone con il costo della risposta è che l'unico riscontro che l'alunno riceve riguarda comportamenti inadeguati.",SANCIRE 
,,"Per cui, come menzionato precedentemente, sarà necessario usare le conseguenze negative per un comportamento inappropriato contemporaneamente con conseguenze positive per il comportamento appropriato.",PRESCRIZIONE 
,"I ripetuti tentativi e i fallimenti negli interventi tendenti a controllare le conseguenze porteranno a confusione, frustrazione e scoraggiamento sia negli insegnanti che negli alunni. Per questa ragione ogni volta che vengono usati interventi sulle conseguenze, è bene seguire alcuni accorgimenti per garantire una maggiore probabilità di successo:
quando il bambino con ADHD mostra il comportamento su cui si vuole intervenire, il feedback dell'insegnante deve essere immediato. Il bambino può così imparare a basarsi su questo
feedback come aiuto al cambiamento; 
- poiché il bambino con ADHD può lavorare per periodi più brevi rispetto ai suoi compagni di classe, le conseguenze devono essere offerte più frequentemente;
- gli incentivi devono essere più ricchi e allettanti, ed è necessario cambiare i rinforzi frequentemente per evitare l'abitudine;
le conseguenze positive dovrebbero essere applicate prima delle conseguenze negative, e le conseguenze negative non dovrebbero mai essere usate da sole, ma sempre in concomitanza con appropriate conseguenze positive.","I ripetuti tentativi e i fallimenti negli interventi tendenti a controllare le conseguenze porteranno a confusione, frustrazione e scoraggiamento sia negli insegnanti che negli alunni. ",PREVISIONE 
,,"Per questa ragione ogni volta che vengono usati interventi sulle conseguenze, è bene seguire alcuni accorgimenti per garantire una maggiore probabilità di successo:",VALUTAZIONE 
,,"quando il bambino con ADHD mostra il comportamento su cui si vuole intervenire, il feedback dell'insegnante deve essere immediato. ",PRESCRIZIONE 
,," poiché il bambino con ADHD può lavorare per periodi più brevi rispetto ai suoi compagni di classe, le conseguenze devono essere offerte più frequentemente; gli incentivi devono essere più ricchi e allettanti, ed è necessario cambiare i rinforzi frequentemente per evitare l'abitudine; le conseguenze positive dovrebbero essere applicate prima delle conseguenze negative, e  le conseguenze negative non dovrebbero mai essere usate da sole, ma sempre in concomitanza con appropriate conseguenze positive.",PRESCRIZIONE 
,"In questi ultimi anni alcune ricerche hanno dimostrato la possibilità di far acquisire al bambino la capacità di monitorare e guidare se stesso verso un maggior autocontrollo. Una procedura particolarmente efficace è quella costituita dal cosiddetto «allenamento al comportamento corrispondente». Questa tecnica consiste nel cercare di incrementare la corrispondenza tra ciò che il bambino dichiara riguardo a come sarà il proprio comportamento e l'effettivo comportamento che egli in seguito manifesta. Così, ad esempio, se un alunno afferma che è disposto ad attendere il permesso dell'insegnante prima di prendere la parola in classe e ritiene di riuscire a non effettuare più di tre interruzioni nell'arco della mattinata, alla fine delle ore di lezione potrà ottenere la ricompensa concordata se l'obiettivo è raggiunto.",In questi ultimi anni alcune ricerche hanno dimostrato la possibilità di far acquisire al bambino la capacità di monitorare e guidare se stesso verso un maggior autocontrollo. Una procedura particolarmente efficace è quella costituita dal cosiddetto «allenamento al comportamento corrispondente».,SANCIRE 
,,Questa tecnica consiste nel cercare di incrementare la corrispondenza tra ciò che il bambino dichiara riguardo a come sarà il proprio comportamento e l'effettivo comportamento che egli in seguito manifesta.,DESCRIZIONE
,,"Così, ad esempio, se un alunno afferma che è disposto ad attendere il permesso dell'insegnante prima di prendere la parola in classe e ritiene di riuscire a non effettuare più di tre interruzioni nell'arco della mattinata, alla fine delle ore di lezione potrà ottenere la ricompensa concordata se l'obiettivo è raggiunto.",SPECIFICAZIONE
,"Quindi, in questa procedura, il bambino non viene rinforzato per ogni singolo comportamento, ma per essere riuscito ad attenersi alla sue previsioni riguardo all'obiettivo comportamentale finale. La procedura ha un'articolazione abbastanza complessa che prevede un'accurata misurazione di base, una definizione operazionale dell'obiettivo, un preciso monitoraggio e una scelta attenta delle contingenze di rinforzo.
Una volta scelto il comportamento su cui intervenire, l'applicazione di questa tecnica richiede tre fasi. Per completare ciascuna fase sono necessari alcuni giorni di allenamento per il bambino. 
prima fase consiste nel costruire un accordo comportamentale
nel corso del quale viene evidenziato al bambino il comporta-
mento indesiderabile da modificare, chiedendogli la disponibilità limitare il verificarsi di quel comportamento e a impegnarsi ad
assumere modi di agire alternativi e desiderabili. Viene inoltre
ricordata al bambino la possibilità di guadagnarsi opportune
ricompense e cosa è necessario perché ciò avvenga.  2. La fase successiva è quella del monitoraggio in cui l'insegnante osserva sistematicamente il comportamento dell'alunno per
verificare se egli si attenga a quanto concordato. 3. Nella fase finale della procedura la «scheda di osservazione del comportamento viene esaminata assieme all'alunno, mettendo in evidenza se l'obiettivo concordato è stato raggiunto oppure no. Nel caso sia stato raggiunto verrà concessa al bambino la ricompensa stabilita.  Al fine di mantenere un buon livello di motivazione nell'alunno e una sufficiente collaborazione, è bene che il non raggiungimento dell'obiettivo concordato non abbia nessuna conseguenza negativa al di fuori della mancata concessione della ricompensa. È stato dimostrato che con bambini con ADHD con problemi comportamentali la procedura di allenamento al comportamento corrispondente dà buoni risultati in tempi relativamente brevi, riuscendo a coinvolgere senza troppe difficoltà il bambino . In base all’età dell'alunno e alla problematicità dei suoi comportamenti, questa tecnica può richiedere particolari adattamenti e l'impiego complementare di altre procedure basate sulle conseguenze positive e negative.","Quindi, in questa procedura, il bambino non viene rinforzato per ogni singolo comportamento, ma per essere riuscito ad attenersi alla sue previsioni riguardo all'obiettivo comportamentale finale.",CONTRAPPOSIZIONE
,,"La procedura ha un'articolazione abbastanza complessa che prevede un'accurata misurazione di base, una definizione operazionale dell'obiettivo, un preciso monitoraggio e una scelta attenta delle contingenze di rinforzo. ",GIUDIZIO
,,"Una volta scelto il comportamento su cui intervenire, l'applicazione di questa tecnica richiede tre fasi.  1. prima fase consiste nel costruire un accordo comportamentale
nel corso del quale viene evidenziato al bambino il comportamento indesiderabile da modificare, chiedendogli la disponibilità a limitare il verificarsi di quel comportamento e a impegnarsi ad assumere modi di agire alternativi e desiderabili. Viene inoltre ricordata al bambino la possibilità di guadagnarsi opportune ricompense e cosa è necessario perché ciò avvenga. 2. La fase successiva è quella del monitoraggio in cui l'insegnante osserva sistematicamente il comportamento dell'alunno per
verificare se egli si attenga a quanto concordato. 3. Nella fase finale della procedura la «scheda di osservazione del comportamento viene esaminata assieme all'alunno, mettendo in evidenza se l'obiettivo concordato è stato raggiunto oppure no. Per completare ciascuna fase sono necessari alcuni giorni di allenamento per il bambino. Nel caso sia stato raggiunto verrà concessa al bambino la ricompensa stabilita. ",RIFERIMENTO OBIETTIVO 
,,"Al fine di mantenere un buon livello di motivazione nell'alunno e una sufficiente collaborazione, è bene che il non raggiungimento dell'obiettivo concordato non abbia nessuna conseguenza negativa al di fuori della mancata concessione della ricompensa.",RIFERIMENTO OBIETTIVO 
,,"È stato dimostrato che con bambini con ADHD con problemi comportamentali la procedura di allenamento al comportamento corrispondente dà buoni risultati in tempi relativamente brevi, riuscendo a coinvolgere senza troppe difficoltà il bambino ",SANCIRE 
,,"In base all’età dell'alunno e alla problematicità dei suoi comportamenti, questa tecnica può richiedere particolari adattamenti e l'impiego complementare di
altre procedure basate sulle conseguenze positive e negative.",VALUTAZIONE 
,"I bambini non gradiscono il time out, in quanto comporta la perdita di qualcosa, sia essa l'attenzione degli adulti o dei compagni, o la possibilità di disturbare gli altri il timore e la considerazione da parte dei compagni. Di solito il
bambino si sente irritato e ostile quando viene inviato in time out, ma tali sentimenti svaniscono abbastanza rapidamente al termine della sospensione. Se l'alunno viene messo sistematicamente in time out quando manifesta determinati comportamenti, sarà sempre più motivato a ridurre tali reazioni e a escogitare altre e più desiderabili modalità di comportamento. E se questi nuovi modi di agire verranno adeguatamente ricompensati e incoraggiati, sarà sempre più probabile che in futuro tendano a consolidarsi in alternativa
ai comportamenti indesiderabili.  I bambini non vogliono abbandonare i loro comportamenti turbolenti. Ma se continuano con questi comportamenti problematici, ricevono ripetuti time out. Di conseguenza, trovano più semplice abbandonare questi comportamenti problematici.
I bambini, poi, esplorano modi diversi di soddisfare i propri bisogni. Quando vengono premiati, i nuovi comportamenti ne risultano rafforzati e aumenta la probabilità che in futuro si verifichino. Il time out indebolisce i vecchi comportamenti problematici e stimola la comparsa di un nuovo comportamento accettabile. Il time out, purché applicato correttamente, è sicuro ed efficace nel porre fine al comportamento negativo dell'alunno. "," I bambini non gradiscono il time out, ",SANCIRE 
,,"in quanto comporta la perdita di qualcosa,",CONFERMA 
,," sia essa l'attenzione degli adulti o dei compagni, o la possibilità di disturbare gli altri il timore e la considerazione da parte dei compagni.",SPECIFICAZIONE 
,,"Di solito il bambino si sente irritato e ostile quando viene inviato in time out, ",SANCIRE 
,,ma tali sentimenti svaniscono abbastanza rapidamente al termine della sospensione,RIDIMENSIONAMENTO 
,,"Se l'alunno viene messo sistematicamente in time out quando manifesta determinati comportamenti, sarà sempre più motivato a ridurre tali reazioni e a escogitare altre e più desiderabili modalità di comportamento.  ",PREVISIONE
,,"E se questi nuovi modi di agire verranno adeguatamente ricompensati e incoraggiati, sarà sempre più probabile che in futuro tendano a consolidarsi in alternativa
ai comportamenti indesiderabili.",IMPLICAZIONE
,, I bambini non vogliono abbandonare i loro comportamenti turbolenti. ,COMMENTO 
,,"Ma se continuano con questi comportamenti problematici, ricevono ripetuti time out Di conseguenza, trovano più semplice abbandonare questi comportamenti problematici.",CAUSA
,,"I bambini, poi, esplorano modi diversi di soddisfare i propri bisogni. ",COMMENTO 
,,"Quando vengono premiati, i nuovi comportamenti ne risultano rafforzati e aumenta la probabilità che in futuro si verifichino.  Il time out indebolisce i vecchi comportamenti problematici e stimola la comparsa di un nuovo comportamento accettabile. Il time outè sicuro ed efficace nel porre fine al comportamento negativo dell'alunno",SANCIRE 
,,", purché applicato correttamente, ",RIDIMENSIONAMENTO 
,"Il time out è efficace nell'aiutare a correggere nell'alunno i comportamenti indesiderati persistenti di tipo impulsivo, aggressivo, emotivo o ostile. Messo a confronto con altre tecniche disciplinari, risulta uno dei più efficaci metodi disponibili per eliminare i problemi di comportamento, sia gravi che moderati. Non è, tuttavia, l'unico metodo disciplinare che può ridurre i seguenti comportamenti della categoria «A».: - picchiare o aggredire - colpire qualcuno con un oggetto - fare dispetti ad altri bambini con ostilità, provocare gli altri - parlare in modo impertinente o rispondere in malo modo - urlare e strillare con rabbia - appropriarsi di oggetti di altri alunni - lanciare oggetti - distruggere i giocattoli/il materiale - dare calci a qualcuno - morsicare qualcuno o minacciare di farlo - tirare i capelli a qualcuno - sputare a qualcuno - lanciare cose sporche contro qualcuno - urlare con odio contro qualcuno promettendo fi fargliela pagare - dare pizzicotti Spettegolare sui compagni
• Fare cose pericolose
• Minacciare a parole o a gesti di colpire o ferire qualcuno
• Imprecare e dire parolacce
• Dare spinte a qualcuno quando si è sulle scale
• Lanciare cibo quando si è a tavola
Danneggiare di proposito banchi, mobili o attrezzature varie
• Lamentarsi rumorosamente o fare richieste insistenti dopo aver ricevuto un ammoni-
mento
• Disturbare qualcuno o fargli versacci
• Interrompere in maniera insistente la lezione, dopo essere stato ammonito
• Disobbedire alla richiesta di smettere immediatamente di comportarsi in un certo modo
Gli insegnanti che hanno applicato efficacemente il time out sono stati in grado di ridurre o eliminare gran parte dei comportamenti negativi della categoria «A». Considerare o no un comportamento negativo o sufficientemente negativo per meritare time out, dipende anche dai valori e dagli obiettivi che si hanno in mente per il bambino. In ogni caso, il time out non deve essere usato per i problemi comportamentali della categoria «B». Tenere il broncio, essere scontroso
• Irritabilità, cattivo umore, suscettibilità
• Non riuscire in qualcosa
• Tenere in disordine i quaderni
• Non fare i compiti o gli esercizi
• Comportamento iperattivo (ma mettete in atto il time out solo per atti aggressivi o
distruttivi)
• Distraibilità, fantasticare o rivolgere l'attenzione a qualcosa non attinente con l'attività
in corso
• Timore, apprensione
• Essere dipendente, timido o passivo
• Isolamento, voglia di stare da solo
• Comportamenti non osservati direttamente dall'insegnante    Per i comportamenti della categoria «B», utilizzate altre forme di gestione dell'alunno. Ignorate attivamente il broncio, il piagnucolare e i capricci. È bene tener presente che il time out è efficace nell'interrompere un comportamento negativo. Minacciare l'alunno di mandarlo in time out non lo stimola a iniziare un'attività complessa e poco gradita. Il time out fa cessare un comportamento indesiderabile, ma non serve per fare iniziare un comportamento adeguato.","Il time out è efficace nell'aiutare a correggere nell'alunno i comportamenti indesiderati persistenti di tipo impulsivo, aggressivo, emotivo o ostile. ",SANCIRE 
,,"Messo a confronto con altre tecniche disciplinari, risulta uno dei più efficaci metodi disponibili per eliminare i problemi di comportamento, sia gravi che moderati. ",CONFERMA
,,"Non è, tuttavia, l'unico metodo disciplinare che può ridurre i seguenti comportamenti della categoria «A».: ",RIDIMENSIONAMENTO 
,,"picchiare o aggredire - colpire qualcuno con un oggetto - fare dispetti ad altri bambini con ostilità, provocare gli altri - parlare in modo impertinente o rispondere in malo modo - urlare e strillare con rabbia - appropriarsi di oggetti di altri alunni - lanciare oggetti - distruggere i giocattoli/il materiale - dare calci a qualcuno - morsicare qualcuno o minacciare di farlo - tirare i capelli a qualcuno - sputare a qualcuno - lanciare cose sporche contro qualcuno - urlare con odio contro qualcuno promettendo fi fargliela pagare - dare pizzicotti Spettegolare sui compagni
• Fare cose pericolose
• Minacciare a parole o a gesti di colpire o ferire qualcuno
• Imprecare e dire parolacce
• Dare spinte a qualcuno quando si è sulle scale
• Lanciare cibo quando si è a tavola
Danneggiare di proposito banchi, mobili o attrezzature varie
• Lamentarsi rumorosamente o fare richieste insistenti dopo aver ricevuto un ammoni-
mento
• Disturbare qualcuno o fargli versacci
• Interrompere in maniera insistente la lezione, dopo essere stato ammonito
• Disobbedire alla richiesta di smettere immediatamente di comportarsi in un certo modo",SPECIFICAZIONE 
,,Gli insegnanti che hanno applicato efficacemente il time out sono stati in grado di ridurre o eliminare gran parte dei comportamenti negativi della categoria «A». ,SANCIRE 
,,"Considerare o no un comportamento negativo o sufficientemente negativo per meritare time out, dipende anche dai valori e dagli obiettivi che si hanno in mente per il bambino. ",VALUTAZIONE
,,"In ogni caso, il time out non deve essere usato per i problemi comportamentali della categoria «B»",PRESCRIZIONE 
,,". Tenere il broncio, essere scontroso
• Irritabilità, cattivo umore, suscettibilità
• Non riuscire in qualcosa
• Tenere in disordine i quaderni
• Non fare i compiti o gli esercizi
• Comportamento iperattivo (ma mettete in atto il time out solo per atti aggressivi o
distruttivi)
• Distraibilità, fantasticare o rivolgere l'attenzione a qualcosa non attinente con l'attività
in corso
• Timore, apprensione
• Essere dipendente, timido o passivo
• Isolamento, voglia di stare da solo
• Comportamenti non osservati direttamente dall'insegnante    ",SPECIFICAZIONE 
,,"Per i comportamenti della categoria «B», utilizzate altre forme di gestione dell'alunno. Ignorate attivamente il broncio, il piagnucolare e i capricci. ",PRESCRIZIONE
,,"È bene tener presente che il time out è efficace nell'interrompere un comportamento negativo. Minacciare l'alunno di mandarlo in time out non lo stimola a iniziare un'attività complessa e poco gradita. Il time out fa cessare un comportamento indesiderabile, ma non serve per fare iniziare un comportamento adeguato.",SANCIRE 
,"Quando viene chiesto all'alunno di eseguire un'attività a lui poco gradita, è probabile che possa reagire in modo insolente o avere una reazione collerica. Con questi comportamenti (quando risponde in malo modo o ha un attacco di collera) è possibile usare il time out. Una volta interrotto questo comportamento disturbante, sarà più facile ottenere che l'alunno esegua i compiti sgradevoli. Assicuratevi di premiare i suoi sforzi nell'iniziare e portare a termine i compiti spiacevoli.","Quando viene chiesto all'alunno di eseguire un'attività a lui poco gradita, è probabile che possa reagire in modo insolente o avere una reazione collerica. Con questi comportamenti (quando risponde in malo modo o ha un attacco di collera) è possibile usare il time out",POSSIBILITA 
,,"Una volta interrotto questo comportamento disturbante, sarà più facile ottenere che l'alunno esegua i compiti sgradevoli. ",SANCIRE 
,," Assicuratevi di premiare i suoi sforzi nell'iniziare e portare a
termine i compiti spiacevoli.",PRESCRIZIONE
