Domanda,Testo,Stralcio,Repertorio
,,"Se invece si vuole ottenere qualche risultato positivo con gli alunni disattenti è opportuno
ricordare qualche accorgimento. Catturare l’attenzione
• Porre una domanda interessante su cui si possa speculare, mostrando una figura o
raccontando una breve storia collegata all’argomento da spiegare e che possa innescare la
discussione.
• Essere un po’ attori, aggiungendo mimica, teatralità e humor alle proprie spiegazioni.
• Aggiungere una dose di mistero agli argomenti che devono essere spiegati, utilizzando
oggetti (scatole o borse) dove viene “nascosto” il concetto principale dell’argomento della
lezione.
• Variare il tono della voce alternando momenti in cui si “tuona” o si sussurra una frase che si
vuole far cogliere agli alunni.
• Dare segnali chiari che richiamino in modo inequivocabile l’attenzione “…aprite bene le
orecchie…ora state tutti molto attenti perché quello che dirò è fondamentale per capire il
resto…ora nessuno, dico nessuno, deve essere distratto…”
• Utilizzare gessi colorati per scrivere alla lavagna.
• Creare aspettativa ed entusiasmo per la lezione che deve essere spiegata.
• Utilizzare molto spesso il contatto oculare, soprattutto con gli alunni più disattenti.
Focalizzare l’attenzione
• Essere sempre visibili a tutti gli studenti.
• Assicurarsi sempre che la propria voce raggiunga perfettamente tutti gli alunni.
• Controllare eventuali fonti di rumore che possano interferire con la propria voce.
• Far sedere gli alunni più disattenti nei primi banchi in modo che siano più visibili
all’insegnanti e guardino meno i compagni.
• Le consegne devono contenere delle istruzioni semplici e brevi. È fondamentale assicurarsi
che il ragazzo abbia compreso le istruzioni di un compito; per essere sicuri di ciò si possono
fare ripetere le consegne (“…Cosa devi fare?”).
• Inserire il maggior numero di esemplificazioni e dimostrazioni pratiche durante le proprie
spiegazioni. Utilizzare un fascio di luce, o un pointer a laser rosso, da indirizzare verso gli stimoli a cui
bisogna prestare particolare attenzione.
• Utilizzare il più possibile supporti visivi: parole chiave colorate sulla lavagna, semplici
schemi, oggetti interessanti, gesti esemplificativi.
• Illustrare, illustrare, illustrare: disegnare alla lavagna i concetti chiave della lezioni, anche se
le proprie abilità grafiche non sono particolarmente brillanti.
• Nel caso non sia disponibile altro materiale scritto, insegnare agli studenti a scrivere brevi,
ma essenziali, note della spiegazione orale. Mantenere l’attenzione
• Muoversi all’interno della classe per essere sempre visibili.
• Essere moto preparati sulla lezione da spiegare ed evitare “tempi vuoti”.
• Definire con chiarezza i tempi necessari per svolgere le attività giornaliere.
• Utilizzare domande che presuppongono risposte aperte, su cui effettuare un certo
ragionamento e che lascino spazio a risposte diversificate al fine di mantenere la discussione
tra gli studenti.
• Ridurre il più possibile il tempo della propria spiegazione orale e lasciare più spazio ai
commenti degli studenti e alle dimostrazioni pratiche.
• Strutturare le lezioni in modo da favorire il lavoro per piccoli gruppo (vedi apprendimento
cooperativo e peer tutoring).
• Il richiamo verbale dell’insegnante (“…Francesco, stai attento; non distrarti…”) deve essere immediato all’evento negativo, altrimenti, a causa dei loro problemi motivazionali e
di memoria, gli alunni disattenti non riescono a capire la ragione e il senso del richiamo.
• Utilizzare il nome degli studenti distratti per la spiegazione.
• Costruire situazioni di gioco per favorire la comprensione delle spiegazioni.
Per il lavoro individuale al proprio posto
• Controllare costantemente la chiarezza delle istruzioni impartite. Assicurarsi che tutti gli
studenti abbiano veramente capito qual è il loro compito prima di lasciarli lavorare da soli.
• Assicurarsi in anticipo che il lavoro assegnato è congruo con il tempo a disposizione,
soprattutto per gli alunni più disattenti.
• Dare agli studenti un segnale (un cartoncino colorato con una scritta) che possono utilizzare
per richiedere l’aiuto dell’insegnante nei momenti di difficoltà.
• Rinforzare e gratificare regolarmente per un determinato numero di compiti svolti con una
certa accuratezza e impegno (soprattutto per i più disattenti e meno motivati).
• Utilizzare un sistema di “perdita di privilegi o premi promessi” (costo della risposta) nel
caso in cui lo studente non sia orientato al compito e sia stato precedentemente avvertito
delle conseguenze di tale comportamento.",RIFERIMENTO OBIETTIVO 
,"Per riuscire ad essere pragmatici senza essere semplicisti abbiano individuato una serie di
accorgimenti rivolti in modo specifico agli insegnanti, in un'ottica di comprensione delle difficoltà
dell'alunno.  Prima di iniziare a lavorare…
1. Quando vengono spiegate le lezioni o vengono date delle istruzioni per eseguire dei compiti è
importante che l'insegnante si accerti del livello di attenzione del bambino: spesso i bambini
iperattivi sono fisicamente e mentalmente occupati a fare qualcos’altro (roteare penne, guardare
o chiamare i compagni). In generale il contatto oculare è la tecnica più efficace per controllare
l’attenzione del bambino.
2. Le consegne devono contenere delle istruzioni semplici e brevi. È fondamentale assicurarsi che
il ragazzo abbia compreso le istruzioni di un compito; per essere sicuri di cio' si possono fare ripetere le
consegne (“cosa devi fare?”).
3. Una volta dato un testo di un problema di aritmetica o un testo che contenga delle istruzioni è
opportuno aiutare il ragazzo disattento/iperattivo ad individuare (sottolineandole con diversi
colori) le parti importanti del testo.
Anche l’organizzazione della classe puo’ aiutare…
A prescindere dal fatto che la migliore collocazione è a discrezione dell’insegnante…
1. è opportuno controllare le fonti di distrazione all’interno della classe: non è indicato far sedere il
ragazzo vicino alla finestra, al cestino, ad altri compagni rumorosi o ad altri oggetti molto
interessanti. Non è ugualmente produttivo collocare l’allievo in una zona completamente priva
di stimolazioni in quanto egli diventa più iperattivo perchè va alla ricerca di situazioni nuove e
interesssanti.
2. Disporre i banchi in modo che l’insegnante possa passare frequentemente in mezzo ad essi, in
modo da controllare che i più distratti abbiano capito il compito, stiano seguendo la lezione e
stiano eseguendo il lavoro assegnato.","Per riuscire ad essere pragmatici senza essere semplicisti abbiano individuato una serie di
accorgimenti rivolti in modo specifico agli insegnanti, in un'ottica di comprensione delle difficoltà
dell'alunno.  Prima di iniziare a lavorare…
1. Quando vengono spiegate le lezioni o vengono date delle istruzioni per eseguire dei compiti è
importante che l'insegnante si accerti del livello di attenzione del bambino: 
2. Le consegne devono contenere delle istruzioni semplici e brevi. . 3. Una volta dato un testo di un problema di aritmetica o un testo che contenga delle istruzioni è
opportuno aiutare il ragazzo disattento/iperattivo ad individuare (sottolineandole con diversi
colori) le parti importanti del testo.
Anche l’organizzazione della classe puo’ aiutare…
1. è opportuno controllare le fonti di distrazione all’interno della classe
",RIFERIMENTO OBIETTIVO 
,,"È fondamentale assicurarsi che
il ragazzo abbia compreso le istruzioni di un compito; per essere sicuri di cio' si possono fare ripetere le
consegne (“cosa devi fare?”)",PROPOSTA
,," In generale il contatto oculare è la tecnica più efficace per controllare
l’attenzione del bambino.",SANCIRE 
,,A prescindere dal fatto che la migliore collocazione è a discrezione dell’insegnante…,COMMENTO 
,,": non è indicato far sedere il
ragazzo vicino alla finestra, al cestino, ad altri compagni rumorosi o ad altri oggetti molto
interessanti. Non è ugualmente produttivo collocare l’allievo in una zona completamente priva
di stimolazioni in quanto egli diventa più iperattivo perchè va alla ricerca di situazioni nuove e
interesssanti.",SANCIRE 
,,"2. Disporre i banchi in modo che l’insegnante possa passare frequentemente in mezzo ad essi, in modo da controllare che i più distratti abbiano capito il compito, stiano seguendo la lezione e stiano eseguendo il lavoro assegnato.",RIFERIMENTO OBIETTIVO 
,"Alcuni suggerimenti per la gestione delle lezioni…
1. Accorciare i tempi di lavoro. Fare brevi e frequenti pause soprattutto durante i compiti ripetitivi
e noiosi.
2. Rendere le lezioni stimolanti e ricche di novità: i bambini con ADHD hanno peggiori prestazioni quando i compiti sono noiosi e ripetitivi (ad esempio un brano di un libro viene
compreso meglio se contiene delle figure. ","Alcuni suggerimenti per la gestione delle lezioni…
1. Accorciare i tempi di lavoro. Fare brevi e frequenti pause soprattutto durante i compiti ripetitivi
e noiosi.
2. Rendere le lezioni stimolanti e ricche di novità: ",RIFERIMENTO OBIETTIVO 
,,i bambini con ADHD hanno peggiori prestazioni quando i compiti sono noiosi e ripetitivi ,SANCIRE 
,,(ad esempio un brano di un libro viene compreso meglio se contiene delle figure). ,CONFERMA 
,"Anche il ritmo della voce dell'insegnante quando
spiega puo’ incidere sulla capacità attentiva degli studenti.
a) Interagire frequentemente, verbalmente e fisicamente, con gli studenti.
b) Fare in modo che gli allievi debbano rispondere frequentemente durante la lezione.
c) Utilizzare il nome degli studenti distratti per la spiegazione.
d) Costruire situazioni di gioco per favorire la comprensione delle spiegazioni.
e) Utilizzare il gioco di ruoli per spiegare concetti storici, sociali in cui siano coinvolti vari
personaggi.
f) Abituare il ragazzo impulsivo a controllare il proprio lavoro svolto.
","Anche il ritmo della voce dell'insegnante quando
spiega puo’ incidere sulla capacità attentiva degli studenti.
a) Interagire frequentemente, verbalmente e fisicamente, con gli studenti.
b) Fare in modo che gli allievi debbano rispondere frequentemente durante la lezione.
c) Utilizzare il nome degli studenti distratti per la spiegazione.
d) Costruire situazioni di gioco per favorire la comprensione delle spiegazioni.
e) Utilizzare il gioco di ruoli per spiegare concetti storici, sociali in cui siano coinvolti vari
personaggi.
f) Abituare il ragazzo impulsivo a controllare il proprio lavoro svolto.
",PROPOSTA
,"Anche l’ordine puo’ aiutare…
1. È importante stabilire delle attività programmate e routinarie in modo che il ragazzo impari a
prevedere quali comportamenti deve produrre in determinati momenti della giornata.
2. È importante definire con chiarezza i tempi necessari per svolgere le attività giornaliere,
rispettando i tempi dello studente (questo lo aiuta anche ad orientarsi meglio nel tempo).
3. Aiutare l’allievo iperattivo a gestire meglio il proprio materiale: l’insegnante dovrebbe
dimostrare che dà importanza all’organizzazione lasciando 5’ al giorno per ordinare il proprio
materiale.
a) Proporsi come modello per mantenere in ordine il proprio materiale e mostrare alcune strategie
per fare fronte alle situazioni di disorganizzazione.
b) Aiutare il ragazzo ad applicare (o inventare) delle strategie per tenere in ordine il proprio
materiale.
c) Premiare il banco meglio organizzato del giorno.
4. Utilizzare il diario per la comunicazione giornaliera con la famiglia (non per scrivere note
negative sul comportamento).
","Anche l’ordine puo’ aiutare…
1. È importante stabilire delle attività programmate e routinarie in modo che il ragazzo impari a
prevedere quali comportamenti deve produrre in determinati momenti della giornata.
2. È importante definire con chiarezza i tempi necessari per svolgere le attività giornaliere,
rispettando i tempi dello studente (questo lo aiuta anche ad orientarsi meglio nel tempo).
3. Aiutare l’allievo iperattivo a gestire meglio il proprio materiale: l’insegnante dovrebbe
dimostrare che dà importanza all’organizzazione lasciando 5’ al giorno per ordinare il proprio
materiale.
a) Proporsi come modello per mantenere in ordine il proprio materiale e mostrare alcune strategie
per fare fronte alle situazioni di disorganizzazione.
b) Aiutare il ragazzo ad applicare (o inventare) delle strategie per tenere in ordine il proprio
materiale.
c) Premiare il banco meglio organizzato del giorno.
4. Utilizzare il diario per la comunicazione giornaliera con la famiglia (non per scrivere note
negative sul comportamento).
",PROPOSTA
,"E per gestire il comportamento cosa si puo’ fare...
1. Innanzitutto è opportuno definire e mantenere chiare e semplici regole all’interno della classe (è
importante ottenere un consenso unanime su queste regole).
2. Rivedere e correggere le regole della classe, quando se ne ravvede la necessità.
3. Spesso, è necessario spiegare chiaramente agli alunni disattenti/iperattivi quali sono i
comportamenti adeguati e quali sono quelli inappropriati.
4. È molto importante fare capire agli allievi impulsivi quali sono le conseguenze dei loro
comportamenti positivi e quali sono quelle che derivano da quelli negativi.
5. È più utile rinforzare e premiare i comportamenti positivi (stabiliti precedentemente), piuttosto
che punire quelli negativi.
6. Fare esercizi di perdono e sottolineare i comportamenti adeguati del ragazzo attraverso ampie ed
evidenti gratificazioni.
7. Avere la possibilità di cambiare i rinforzi quando questi perdono di efficacia. 8. Si raccomanda di non punire il ragazzo togliendo l’intervallo, perchè il ragazzo iperattivo
necessita di scaricare la tensione e di socializzare con i compagni.
9. Le punizioni severe, note scritte o sospensioni, non modificano il comportamento del bambino.
10. È importante stabilire giornalmente o settimanalmente semplici obiettivi da raggiungere.
11. È utile informare frequentemente il ragazzzo su come sta lavorando e come si sta comportando
soprattutto rispetto agli obiettivi da raggiungere.
","E per gestire il comportamento cosa si puo’ fare...
1. Innanzitutto è opportuno definire e mantenere chiare e semplici regole all’interno della classe (è
importante ottenere un consenso unanime su queste regole).
2. Rivedere e correggere le regole della classe, quando se ne ravvede la necessità.
3. Spesso, è necessario spiegare chiaramente agli alunni disattenti/iperattivi quali sono i
comportamenti adeguati e quali sono quelli inappropriati.
4. È molto importante fare capire agli allievi impulsivi quali sono le conseguenze dei loro
comportamenti positivi e quali sono quelle che derivano da quelli negativi.
5. È più utile rinforzare e premiare i comportamenti positivi (stabiliti precedentemente), piuttosto
che punire quelli negativi.
6. Fare esercizi di perdono e sottolineare i comportamenti adeguati del ragazzo attraverso ampie ed
evidenti gratificazioni.
7. Avere la possibilità di cambiare i rinforzi quando questi perdono di efficacia. 8. Si raccomanda di non punire il ragazzo togliendo l’intervallo, perchè il ragazzo iperattivo
necessita di scaricare la tensione e di socializzare con i compagni.
9. Le punizioni severe, note scritte o sospensioni, non modificano il comportamento del bambino.
10. È importante stabilire giornalmente o settimanalmente semplici obiettivi da raggiungere.
11. È utile informare frequentemente il ragazzzo su come sta lavorando e come si sta comportando
soprattutto rispetto agli obiettivi da raggiungere.
",PROPOSTA
,"Ogni intervento per ridurre i comportamenti antisociali è più efficace se iniziato prima che il
bambino abbia 9 anni; perché altrimenti la personalità del bambino diventa più strutturata e difficile
da modificare.
Gli antecedenti
Gli eventi antecedenti sono fatti o condizioni che si verificano prima del comportamento
problematico (confusione in classe durante l’assegnazione dei compiti). Gli eventi antecedenti
determinano la probabilità che si verifichi un certo comportamento antisociale, ad esempio molte
istruzioni seguite da numerosi errori sono fatti che con buone probabilità sono seguiti da espressioni
comportamentali aggressive. Un evento antecedente può essere anche una lite familiare. È
necessario fronteggiare tale problema con delle regole scolastiche chiare, con un sostegno reciproco
tra insegnanti e tenendo in considerazione le differenze individuali degli studenti. In quest’ultimo
fattore si includono tutte le attività che dovrebbe mettere in atto un insegnante considerando che
ogni alunni presenta differenti tempi di apprendimento, di gratificazione e di comportamento.
Il fallimento scolastico è uno dei più efficaci predittori del vandalismo e dei comportamenti
antisociali.
INTERVENTO DI PREVENZIONE ATTRAVERSO LA DISCIPLINA COSTRUTTIVA
Secondo questo approccio, l’enfasi viene posta sullo sviluppo di comportamenti adeguati piuttosto
che sulla punizione di quelli negativi. Innanzitutto è necessario individuare: 1) comportamenti da
sviluppare o da rafforzare; 2) repertori di competenze scolastiche e sociali che l’alunno possiede e
sulle quali si può lavorare; 3) procedure di modifica di tali repertori; 4) contingenze rinforzanti che
aumentino e mantengano i comportamenti appropriati. Le regole della classe devono essere discusse e approvate da tutta la classe (insegnanti e studenti),
le regole devono essere ben visibili e di tanto in tanto discusse e riviste. Gli alunni devono essere
premiati dall’osservanza delle regole: se si vuole che le regole vengano rispettate l’osservanza e
l’inosservanza devono essere seguite da conseguenze diverse. Le regole devono essere positive:
devono prescrivere, non vietare. La lista deve essere breve, al massimo 6-7 regole.
Se si vuole che gli insegnanti sentano il sostegno reciproco anche i dirigenti scolastici devono
esprimere il loro apprezzamento per il lavoro svolto nelle classi per applicare la disciplina
costruttiva. Gli insegnanti si devono consultare reciprocamente per sperimentare le modalità di
applicazione della disciplina costruttiva.
Le differenze individuali vengono rispettate adeguando i metodi e i materiali al rendimento
dell’alunno. Altre tecniche educative suggerite sono: 1) aumentare l’uso delle lodi e delle forme di
riconoscimento nei confronti degli alunni che manifestano maggiori comportamenti costruttivi; 2)
identificare e massimizzare le gratificazioni; 3) utilizzare il modeling e tecniche di rinforzo
differenziale; 4) usare contingenze di gruppo.","Ogni intervento per ridurre i comportamenti antisociali è più efficace se iniziato prima che il
bambino abbia 9 anni; perché altrimenti la personalità del bambino diventa più strutturata e difficile
da modificare.",CAUSA 
,,"Gli antecedenti
Gli eventi antecedenti sono fatti o condizioni che si verificano prima del comportamento
problematico (confusione in classe durante l’assegnazione dei compiti). 
",DESCRIZIONE
,,"Gli eventi antecedenti
determinano la probabilità che si verifichi un certo comportamento antisociale, ",CAUSA 
,,"ad esempio molte
istruzioni seguite da numerosi errori sono fatti che con buone probabilità sono seguiti da espressioni
comportamentali aggressive. Un evento antecedente può essere anche una lite familiare. ",SPECIFICAZIONE 
,,"È
necessario fronteggiare tale problema con delle regole scolastiche chiare, con un sostegno reciproco
tra insegnanti e tenendo in considerazione le differenze individuali degli studenti. ",PRESCRIZIONE
,,"Il fallimento scolastico è uno dei più efficaci predittori del vandalismo e dei comportamenti
antisociali.",COMMENTO 
,,"INTERVENTO DI PREVENZIONE ATTRAVERSO LA DISCIPLINA COSTRUTTIVA
Secondo questo approccio, l’enfasi viene posta sullo sviluppo di comportamenti adeguati piuttosto
che sulla punizione di quelli negativi. ",CONTRAPPOSIZIONE 
,,"Innanzitutto è necessario individuare: 1) comportamenti da
sviluppare o da rafforzare; 2) repertori di competenze scolastiche e sociali che l’alunno possiede e
sulle quali si può lavorare; 3) procedure di modifica di tali repertori; 4) contingenze rinforzanti che
aumentino e mantengano i comportamenti appropriati. ",PRESCRIZIONE
,,"Le regole della classe devono essere discusse e approvate da tutta la classe (insegnanti e studenti),
le regole devono essere ben visibili e di tanto in tanto discusse e riviste. Gli alunni devono essere
premiati dall’osservanza delle regole:  Le regole devono essere positive:
devono prescrivere, non vietare. La lista deve essere breve, al massimo 6-7 regole.
",PRESCRIZIONE
,,"Se si vuole che gli insegnanti sentano il sostegno reciproco anche i dirigenti scolastici devono
esprimere il loro apprezzamento per il lavoro svolto nelle classi per applicare la disciplina
costruttiva. ",RIFERIMENTO OBIETTIVO 
,,"Gli insegnanti si devono consultare reciprocamente per sperimentare le modalità di
applicazione della disciplina costruttiva.
",PRESCRIZIONE
,,"Altre tecniche educative suggerite sono: 1) aumentare l’uso delle lodi e delle forme di
riconoscimento nei confronti degli alunni che manifestano maggiori comportamenti costruttivi; 2)
identificare e massimizzare le gratificazioni; 3) utilizzare il modeling e tecniche di rinforzo
differenziale; 4) usare contingenze di gruppo.",PROPOSTA
,"Un rinforzo è qualsiasi evento, oggetto, comportamento o situazione che favorisce la ricomparsa di
una azione alla quale il rinforzo stesso sia seguito come conseguenza. (Se il bambino ha messo in
atto l’azione A, si definisce rinforzo qualsiasi conseguenza applicata ad A che sia risultata piacevole
per il bambino e che favorirà la comparsa in futuro della stessa azione).
Utilizzando correttamente i rinforzi è possibile favorire la messa in atto da parte del bambino di
comportamenti che i genitori ritengono positivi e quindi desiderabili.
Per prima cosa dobbiamo pensare quali sono i comportamenti che vorremmo vedere più spesso nel
bambino, partendo ad esempio dalla riflessione sui punti deboli e forti; è importante individuare
pochi comportamenti, i più importanti, che vogliamo gratificare regolarmente ogni volta che
vengono messi in atto dal bambino.
A questo scopo, non si deve pensare ad un comportamento che il bambino non ha mai attuato,
perché in questo caso non ci sarebbero le occasioni per rinforzarlo: non si può infatti premiare un
comportamento mai avvenuto. Bisogna invece individuare un comportamento che il bambino
conosce e produce anche se non ancora nella misura e con la frequenza desiderata dai genitori.
Per rendere più facile e precisare la registrazione dei comportamenti positivi e delle conseguenze ad
essi associati si può utilizzare uno schema a tre colonne come questo..","Un rinforzo è qualsiasi evento, oggetto, comportamento o situazione che favorisce la ricomparsa di
una azione alla quale il rinforzo stesso sia seguito come conseguenza. (",DESCRIZIONE
,,"Se il bambino ha messo in
atto l’azione A, si definisce rinforzo qualsiasi conseguenza applicata ad A che sia risultata piacevole
per il bambino e che favorirà la comparsa in futuro della stessa azione).",SPECIFICAZIONE 
,,"Utilizzando correttamente i rinforzi è possibile favorire la messa in atto da parte del bambino di
comportamenti che i genitori ritengono positivi e quindi desiderabili.
",IMPLICAZIONE 
,,"Per prima cosa dobbiamo pensare quali sono i comportamenti che vorremmo vedere più spesso nel
bambino, partendo ad esempio dalla riflessione sui punti deboli e forti; è importante individuare
pochi comportamenti, i più importanti, che vogliamo gratificare regolarmente ogni volta che
vengono messi in atto dal bambino.
",PRESCRIZIONE
,,"A questo scopo, non si deve pensare ad un comportamento che il bambino non ha mai attuato,
perché in questo caso non ci sarebbero le occasioni per rinforzarlo: ",PREVISIONE
,,"non si può infatti premiare un
comportamento mai avvenuto. ",CONFERMA
,,"Bisogna invece individuare un comportamento che il bambino
conosce e produce anche se non ancora nella misura e con la frequenza desiderata dai genitori.
",PRESCRIZIONE
,,"Per rendere più facile e precisare la registrazione dei comportamenti positivi e delle conseguenze ad
essi associati si può utilizzare uno schema a tre colonne come questo..",PROPOSTA
,"Il potere dell’insegnante e del genitore
consiste proprio nel riuscire a far capire al bambino quali sono le azioni che ci si aspetta da lui; se il
bambino sa esattamente quello che deve fare, allora il suo comportamento diventa un po’ più
regolato, più controllato.
Perciò è importante dare pochi comandi alla volta, perché altrimenti rischiamo di confondere ancora
di più il bambino che non sa più quello che gli altri si aspettano da lui.
","Il potere dell’insegnante e del genitore
consiste proprio nel riuscire a far capire al bambino quali sono le azioni che ci si aspetta da lui;",SANCIRE 
,," se il
bambino sa esattamente quello che deve fare, allora il suo comportamento diventa un po’ più
regolato, più controllato.
",CAUSA 
,,"Perciò è importante dare pochi comandi alla volta, perché altrimenti rischiamo di confondere ancora
di più il bambino che non sa più quello che gli altri si aspettano da lui.",VALUTAZIONE 
