Domanda,Testo,Stralcio,Repertorio
,," (es. le domande fondamentali, il
percorso da compiere, le tavole del contenuto).",SPECIFICAZIONE 
,,"(es. usare fogli a quadretti per la
matematica, stabilire degli standard per i compiti, essere il più specifici
possibile).",SPECIFICAZIONE 
,,"(es. scritte a macchina, con il computer, registrate a voce).",SPECIFICAZIONE 
,,"(es. dandogli anche delle
istruzioni scritte, permettendogli di prendere appunti).",SPECIFICAZIONE 
,"ACCORGIMENTI PER COMPLETARE IN TEMPO I COMPITI ASSEGNATI.
 Incrementare l’organizzazione del lavoro con l’uso di liste, diari, quaderni di
appunti, cartelline.
1. Assegnare i compiti al bambino scrivendoli su agendine tascabili.
2. Scrivere i compiti assegnati sulla lavagna ed assicurarsi che li abbia copiati.
 Stabilire le consuetudini per quanto riguarda l’uso dei materiali della classe e
per il vestiario.
1. Aiutare il bambino ad organizzare, con l’uso di raccoglitori, i compiti già fatti e
quelli da svolgere; lo stesso vale per gli appunti presi in classe per mantenerli in
ordine cronologico.
2. Spingere i genitori a stabilire in casa consuetudini giornaliere su come riporre i
libri ed usare il materiale scolastico.
3. Aiutare il bambino a tenere in ordine il banco organizzandogli lo spazio.
 Organizzare il suo ambiente con divisori e materiali colorati.
1. Insegnare al bambino l’abitudine di porsi delle domande prima di iniziare
qualcosa o di lasciare un luogo (es. “Ho tutto quello che mi serve?”)
2. Scrivere promemoria da mettergli sul banco, sui libri, sul diario.
3. Incrementare la programmazione sequenziale del pensiero.
 Esercitarsi alla programmazione.
1. Programmare le differenti attività (di cosa si ha bisogno, come dividere i compiti
in più parti)
2. Prevedere il tempo necessario per ogni singola attività.
3. Insegnare strategie per studiare.
 Usare classificazioni, divisioni logiche, ripartizioni.
1. Insegnare l’uso di sistemi di scrittura col computer per riordinare le idee.
2. Insegnare al bambino a prendere note divise in tre colonne quando ascolta le
spiegazioni o legge il materiale (punti principali, punti di supporto, domande).","ACCORGIMENTI PER COMPLETARE IN TEMPO I COMPITI ASSEGNATI.
 Incrementare l’organizzazione del lavoro con l’uso di liste, diari, quaderni di
appunti, cartelline.
1. Assegnare i compiti al bambino scrivendoli su agendine tascabili.
2. Scrivere i compiti assegnati sulla lavagna ed assicurarsi che li abbia copiati.
 Stabilire le consuetudini per quanto riguarda l’uso dei materiali della classe e
per il vestiario.
1. Aiutare il bambino ad organizzare, con l’uso di raccoglitori, i compiti già fatti e
quelli da svolgere; lo stesso vale per gli appunti presi in classe per mantenerli in
ordine cronologico.
2. Spingere i genitori a stabilire in casa consuetudini giornaliere su come riporre i
libri ed usare il materiale scolastico.
3. Aiutare il bambino a tenere in ordine il banco organizzandogli lo spazio.
 Organizzare il suo ambiente con divisori e materiali colorati.
1. Insegnare al bambino l’abitudine di porsi delle domande prima di iniziare
qualcosa o di lasciare un luogo (es. “Ho tutto quello che mi serve?”)
2. Scrivere promemoria da mettergli sul banco, sui libri, sul diario.
3. Incrementare la programmazione sequenziale del pensiero.
 Esercitarsi alla programmazione.
1. Programmare le differenti attività (di cosa si ha bisogno, come dividere i compiti
in più parti)
2. Prevedere il tempo necessario per ogni singola attività.
3. Insegnare strategie per studiare.
 Usare classificazioni, divisioni logiche, ripartizioni.
1. Insegnare l’uso di sistemi di scrittura col computer per riordinare le idee.
2. Insegnare al bambino a prendere note divise in tre colonne quando ascolta le
spiegazioni o legge il materiale",RIFERIMENTO OBIETTIVO 
,," (punti principali, punti di supporto, domande).",SPECIFICAZIONE 
,"ACCORGIMENTI PER OVVIARE AD UNA SCARSA ABILITA’ MANUALE ALLA
SCRITTURA.
 Ridurre la necessità di scrittura manuale.
1. Non obbligare il bambino a ricopiare del materiale: ciò diminuirà il suo livello di
qualità invece di migliorarlo.
2. Permettere al bambino di utilizzare gli appunti dei compagni o dell’insegnante.
3. Accettare compiti battuti a macchina, scritti al computer o registrati.
 Non pretendere sempre alti livelli di qualità nella scrittura dei compiti ma solo
nelle parti più importanti dove è indispensabile la chiarezza.
1. Colorare, evidenziare, sottolineare quelle lettere che di solito il bambino non è
capace di fare in corsivo.
2. Ridurre lo standard per una scrittura accettabile
3. Evidenziare quelle parti del lavoro particolarmente ben fatte.
ACCORGIMENTI PER MIGLIORARE LA SCARSA STIMA DI SE.
 In generale riconoscere le capacità e gli sforzi del bambino.
1. Richiamare l’attenzione sulle capacità del bambino creando, ogni giorno oppure
ogni settimana, dei momenti in cui lui o lei possano mostrare i loro talenti.
2. Riconoscere che l’eccesso di attività può anche significare un aumento di
energia e di produttività.
3. Riconoscere che essere un capobanda è una qualità da leader.
4. Riconoscere che l’attrazione a nuovi stimoli porta anche alla creatività.
 Aumentare la soddisfazione del successo aiutando il bambino a migliorare le
sue qualità.
1. Riconoscere l’entusiasmo del bambino ed usarlo per sviluppare le sue qualità.
2. Evidenziare i suoi successi e non i suoi errori.
 Coinvolgere il bambino nella soluzione delle sue difficoltà.
1. Fare, insieme al bambino, un elenco dei suoi comportamenti negativi,
descrivendo i momenti più difficili e decidere le strategie che possono essere
adoperate per evitare guai. Questo colloquio va tenuto privatamente, con calma
e con l’atteggiamento di chi cerca di risolvere dei problemi, non per
colpevolizzare il bambino.
2. Fare “giochi di ruolo” con il bambino in queste situazioni per praticare
comportamenti alternativi.
3. Iniziare con un solo comportamento a cambiare, tenendo una scheda apposita
per registrare successi ed insuccessi. Tener conto alla fine di ogni giorno di
quante volte il bambino è riuscito ad adoperare una strategia positiva.
4. Dopo il primo miglioramento, aggiungere un altro comportamento da cambiare e
decidere assieme al bambino la strategia (o le strategie) che devono essere
adoperate.","ACCORGIMENTI PER OVVIARE AD UNA SCARSA ABILITA’ MANUALE ALLA
SCRITTURA.
 Ridurre la necessità di scrittura manuale.
1. Non obbligare il bambino a ricopiare del materiale: 2. Permettere al bambino di utilizzare gli appunti dei compagni o dell’insegnante.
3. Accettare compiti battuti a macchina, scritti al computer o registrati.
 Non pretendere sempre alti livelli di qualità nella scrittura dei compiti ma solo nelle parti più importanti dove è indispensabile la chiarezza.
1. Colorare, evidenziare, sottolineare quelle lettere che di solito il bambino non è capace di fare in corsivo.
2. Ridurre lo standard per una scrittura accettabile
3. Evidenziare quelle parti del lavoro particolarmente ben fatte.
",RIFERIMENTO OBIETTIVO 
,,"ciò diminuirà il suo livello di
qualità invece di migliorarlo.",PREVISIONE 
Il testo come descrive le caratteristiche cliniche del disturbo da deficit dell’attenzione/iperattività?,"Secondo i criteri del DSM-IV (APA 1994), il Disturbo da Deficit Attentivo con Iperattività (ADHD, acronimo
per l’inglese Attention Deficit Hyperactivity Disorder, comunemente utilizzato anche in Italia) e’ caratterizzato
da due gruppi di sintomi o dimensioni psicopatologiche definibili come inattenzione e
impulsività/iperattività. Il deficit attentivo può essere presente già in età prescolare. A quest’età è pero’ difficile formulare una diagnosi
differenziale con altri disturbi e determinare con sicurezza la significativa compromissione del funzionamento
globale: ciò rende spesso indispensabile la formulazione di una diagnosi provvisoria e discutibile l’opportunità
di una terapia farmacologica (Musten et al. 1997; Swanson et al. 1998a). ","Secondo i criteri del DSM-IV (APA 1994), il Disturbo da Deficit Attentivo con Iperattività (ADHD, acronimo
per l’inglese Attention Deficit Hyperactivity Disorder, comunemente utilizzato anche in Italia) e’ caratterizzato
da due gruppi di sintomi o dimensioni psicopatologiche definibili come inattenzione e
impulsività/iperattività.      ",DESCRIZIONE 
,,Il deficit attentivo può essere presente già in età prescolare. ,POSSIBILITA 
,,"A quest’età è pero’ difficile formulare una diagnosi
differenziale con altri disturbi e determinare con sicurezza la significativa compromissione del funzionamento
globale: ",RIDIMENSIONAMENTO 
,,"ciò rende spesso indispensabile la formulazione di una diagnosi provvisoria e discutibile l’opportunità
di una terapia farmacologica",VALUTAZIONE
,"Numerose evidenze indicano che il fattore patogenetico fondamentale del disturbo possa essere costituito da un
deficit nelle capacità di inibizione delle risposte impulsive (response inhibition) mediate dalla corteccia
prefrontale (Schachar & Logan 1990; Barkley 1997); tale deficit appare determinato dalla ipoattività del
Sistema di Inibizione comportamentale, forse associato a deficit nelle capacità di condizionamento (Quay
1988, 1997). In contrasto con tale modello, è stato proposto che l’ADHD sia la manifestazione di
un’alterazione della capacità di autoregolazione dovuta alla difficoltà di allocare uno sforzo adeguato (“risorse
energetiche”) alla attività mentale richiesta.","Numerose evidenze indicano che il fattore patogenetico fondamentale del disturbo possa essere costituito da un deficit nelle capacità di inibizione delle risposte impulsive (response inhibition) mediate dalla corteccia
prefrontale",SANCIRE 
,,"Tale deficit appare determinato dalla ipoattività del
Sistema di Inibizione comportamentale, ",CAUSA
,,forse associato a deficit nelle capacità di condizionamento ,POSSIBILITA 
,," In contrasto con tale modello, è stato proposto che l’ADHD sia la manifestazione di
un’alterazione della capacità di autoregolazione dovuta alla difficoltà di allocare uno sforzo adeguato (“risorse
energetiche”) alla attività mentale richiesta.",CAUSA 
,"Tale Attivazione comportamentale influenza l’attività motoria ed è a sua volta influenzata dall’attività
generale del sistema nervoso centrale, dalla deprivazione di sonno, dalla fatica e, soprattutto, dall’intervallo di
presentazioni degli stimoli (Frowein 1981). Il livello di attivazione aumenta infatti con la velocità di
presentazione degli stimoli; al contrario, quando tale intervallo si allunga, il livello di attivazione diminuisce:
numerosi studi mostrano come le performance dei bambini ADHD diminuiscono quando vengono utilizzati
lunghi intervalli tra gli stimoli (intervallo preparatorio) ovvero quando l’intervallo temporale tra avviso (cue)
ed obbiettivo (target) aumenta.","Tale Attivazione comportamentale influenza l’attività motoria ed è a sua volta influenzata dall’attività
generale del sistema nervoso centrale, dalla deprivazione di sonno, dalla fatica e, soprattutto, dall’intervallo di
presentazioni degli stimoli",CAUSA
,,"Il livello di attivazione aumenta infatti con la velocità di
presentazione degli stimoli; al contrario, quando tale intervallo si allunga, il livello di attivazione diminuisce: numerosi studi mostrano come le performance dei bambini ADHD diminuiscono quando vengono utilizzati
lunghi intervalli tra gli stimoli (intervallo preparatorio) ",CONFERMA 
,,"ovvero quando l’intervallo temporale tra avviso (cue)
ed obbiettivo (target) aumenta.",SPECIFICAZIONE 
,"Indipendentemente dai meccanismi etiopatogenetici coinvolti, nei bambini con ADHD risultano compromesse
in modo variabile le capacità di retrospezione, previsione, preparazione ed imitazione di comportamenti
complessi. Un’alterata o ritardata maturazione della memoria di lavoro non-verbale comporta ritardi nella
maturazione e compromissione delle altre funzioni esecutive: interiorizzazione del discorso autodiretto,
autoregolazione del livello d’attenzione e della motivazione, capacità di scomporre i comportamenti osservati e
ricomposizione in nuovi comportamenti finalizzati. Questi bambini, non raggiungendo la capacità
d’interiorizzazione adeguata all’età, eccedono nelle verbalizzazioni e nel manifestare i propri comportamenti. La difficoltà nello scomporre e ricomporre i comportamenti osservati fa si che questi bambini, sebbene siano in
grado di apprendere comportamenti adeguati in risposta agli stimoli esterni, abbiano significative difficoltà a
generalizzare tali comportamenti nei diversi contesti di vita","Indipendentemente dai meccanismi etiopatogenetici coinvolti, nei bambini con ADHD risultano compromesse
in modo variabile le capacità di retrospezione, previsione, preparazione ed imitazione di comportamenti
complessi.",SANCIRE 
,,"Un’alterata o ritardata maturazione della memoria di lavoro non-verbale comporta ritardi nella
maturazione e compromissione delle altre funzioni esecutive",CAUSA
,,"interiorizzazione del discorso autodiretto,
autoregolazione del livello d’attenzione e della motivazione, capacità di scomporre i comportamenti osservati e
ricomposizione in nuovi comportamenti finalizzati.",SPECIFICAZIONE 
,," Questi bambini, non raggiungendo la capacità
d’interiorizzazione adeguata all’età, eccedono nelle verbalizzazioni e nel manifestare i propri comportamenti.",CAUSA
,,"La difficoltà nello scomporre e ricomporre i comportamenti osservati fa si che questi bambini,  abbiano significative difficoltà a
generalizzare tali comportamenti nei diversi contesti di vita",CAUSA
,,"sebbene siano in
grado di apprendere comportamenti adeguati in risposta agli stimoli esterni,",RIDIMENSIONAMENTO 
,"Nella regolazione delle Funzioni esecutive è specificamente coinvolta la corteccia prefrontale che risulta
anatomicamente e funzionalmente collegata con i nuclei della base (Lou et al. 1998; Swanson et al. 1998b;
Tannock 1998). Negli ultimi anni è stato possibile studiare, con metodi non invasivi, le differenze di volume e di funzionamento di specifiche aree cerebrali. Tecniche di Risonanza Magnetica Nucleare hanno messo in evidenza che la corteccia frontale ed alcuni nuclei della base (nucleo caudato ed il globo pallido) dei bambini
con ADHD risultano più piccoli di quelli dei bambini di controllo: tali differenze risultano maggiori
nell’emisfero destro, ed appaiono correlate in maniera statisticamente significativa con alterazioni nelle
capacità di inibire la risposta motoria a stimoli ambientali (Casey et al. 1997; Catellanos et al. 1996; Filipek et
al. 1997; Mataro et l. 1997). Con tecniche più sofisticate è stato messo in evidenza che, nei bambini e negli
adulti con ADHD, tali regioni del cervello mostrano tempi di attivazione più lenti e consumano meno ossigeno
delle regioni corrispondenti dei bambini o adulti di controllo","Nella regolazione delle Funzioni esecutive è specificamente coinvolta la corteccia prefrontale che risulta
anatomicamente e funzionalmente collegata con i nuclei della base. Negli ultimi anni è stato possibile studiare, con metodi non invasivi, le differenze di volume e di funzionamento di specifiche aree cerebrali.",SANCIRE 
,," Tecniche di Risonanza Magnetica Nucleare hanno messo in evidenza che la corteccia frontale ed alcuni nuclei della base (nucleo caudato ed il globo pallido) dei bambini
con ADHD risultano più piccoli di quelli dei bambini di controllo:",SANCIRE 
,," tali differenze risultano maggiori
nell’emisfero destro, ed appaiono correlate in maniera statisticamente significativa con alterazioni nelle
capacità di inibire la risposta motoria a stimoli ambientali ",SPECIFICAZIONE 
,," Con tecniche più sofisticate è stato messo in evidenza che, nei bambini e negli
adulti con ADHD, tali regioni del cervello mostrano tempi di attivazione più lenti e consumano meno ossigeno
delle regioni corrispondenti dei bambini o adulti di controllo",DESCRIZIONE 
,"Negli ultimi cinque anni diversi gruppi di ricerca hanno
dimostrato che nei soggetti con ADHD sono maggiormente frequenti alcune specifiche varianti di geni che
codificano per il trasportatore della dopamina e per il recettore D4 per la dopamina (DRD4), cui corrispondono
differenze quantitative di funzione (Cook et al. 1995; LaHoste et al. 1996; Smalley et al. 1998; Waldman et al.
1998; Sunohara et al. 1999; Barr 2001). ","Negli ultimi cinque anni diversi gruppi di ricerca hanno
dimostrato che nei soggetti con ADHD sono maggiormente frequenti alcune specifiche varianti di geni che
codificano per il trasportatore della dopamina e per il recettore D4 per la dopamina (DRD4), cui corrispondono
differenze quantitative di funzione ",SANCIRE 
,"L’ADHD tende ad essere presente in diversi membri di una stessa famiglia, e costituisce uno dei disturbi psichiatrici con più elevata ereditabilità. Tra il 50 ed il 90 % dei gemelli monozigoti di bambini con ADHD presenta la stessa sindrome: studi su gemelli adottati suggeriscono che tale familiarità sia genetica
piuttosto che ambientale. Come per altri disturbi psichiatrici è verosimile che i fattori genetici determino la
predisposizione per il disturbo, mentre l’attivazione di tale predisposizione sia modulata anche da fattori
“ambientali”","L’ADHD tende ad essere presente in diversi membri di una stessa famiglia, e costituisce uno dei disturbi psichiatrici con più elevata ereditabilità",SANCIRE 
,,Tra il 50 ed il 90 % dei gemelli monozigoti di bambini con ADHD presenta la stessa sindrome: ,DESCRIZIONE 
,,"studi su gemelli adottati suggeriscono che tale familiarità sia genetica
piuttosto che ambientale. ",SANCIRE 
,,"Come per altri disturbi psichiatrici è verosimile che i fattori genetici determino la
predisposizione per il disturbo, mentre l’attivazione di tale predisposizione sia modulata anche da fattori
“ambientali”",CAUSA
"Il testo come descrive le manifestazioni in ambiente scolastico (interazione con i coetanei, interazione con gli insegnanti, rendimento scolastico) di un alunno con disturbo da deficit attentivo/iperattività?"," I bambini con ADHD mostrano, soprattutto in assenza di un supervisore adulto, un rapido raggiungimento di un elevato livello di ""stanchezza"" e di “noia” che si evidenzia con frequenti spostamenti da un'attività, non completata, ad un'altra, perdita di concentrazione e incapacità di portare a termine qualsiasi attività protratta nel tempo. Nella gran parte delle situazioni, questi bambini hanno difficoltà a controllare i propri impulsi ed a posticipare una gratificazione:
non riescono a riflettere prima di agire, ad aspettare il proprio turno, a lavorare per un premio lontano nel tempo anche se consistente.   "," I bambini con ADHD mostrano, un rapido raggiungimento di un elevato livello di ""stanchezza"" e di “noia” ",SANCIRE 
,,"soprattutto in assenza di un supervisore adulto, ",SPECIFICAZIONE 
,,"che si evidenzia con frequenti spostamenti da un'attività, non completata, ad un'altra, perdita di concentrazione e incapacità di portare a termine qualsiasi attività protratta nel tempo.",SPECIFICAZIONE 
,," Nella gran parte delle situazioni, questi bambini hanno difficoltà a controllare i propri impulsi ed a posticipare una gratificazione:",SANCIRE 
,,"non riescono a riflettere prima di agire, ad aspettare il proprio turno, a lavorare per un premio lontano nel tempo anche se consistente.   ",SPECIFICAZIONE 
,"Questi bambini mostrano una eccessiva attività
motoria (come muovere continuamente le gambe anche da seduti, giocherellare o lanciare oggetti, spostarsi da
una posizione all'altra). L’iperattività compromette l’adeguata esecuzione dei compiti richiesti. Questi bambini
sono visti, nella gran parte dei contesti ambientali, come agitati, irrequieti, incapaci di stare fermi, e sempre sul
punto di partire. ","Questi bambini mostrano una eccessiva attività
motoria ",SANCIRE 
,,"(come muovere continuamente le gambe anche da seduti, giocherellare o lanciare oggetti, spostarsi da
una posizione all'altra). ",SPECIFICAZIONE 
,,L’iperattività compromette l’adeguata esecuzione dei compiti richiesti.,CAUSA
,,"Questi bambini
sono visti, nella gran parte dei contesti ambientali, come agitati, irrequieti, incapaci di stare fermi, e sempre sul
punto di partire.",SANCIRE 
,"L’incapacità a rimanere attenti ed a controllare gli impulsi fa si che, spesso, i bambini con ADHD abbiano una minore resa scolastica e sviluppino con maggiore difficoltà le proprie abilità cognitive. Frequentemente questi
bambini mostrano scarse abilità nell’utilizzazione delle norme di convivenza sociale, in particolare in quelle capacità che consistono nel cogliere quegli indici sociali non verbali che modulano le relazioni interpersonali. Il difficoltoso rapporto con gli altri, le difficoltà scolastiche, i continui rimproveri da parte delle
figure di autorità, il senso di inadeguatezza a contrastare tutto cio’ con le proprie capacità fanno sì che questi
bambini sviluppino un senso di demoralizzazione e di ansia, che accentua ulteriormente le loro difficoltà.
L’incapacità a frenare le proprie reazioni immediate li rende meno accettati dagli adulti e dai coetane","L’incapacità a rimanere attenti ed a controllare gli impulsi fa si che, spesso, i bambini con ADHD abbiano una minore resa scolastica e sviluppino con maggiore difficoltà le proprie abilità cognitive.",CAUSA
,,"Frequentemente questi
bambini mostrano scarse abilità nell’utilizzazione delle norme di convivenza sociale, ",SANCIRE 
,,in particolare in quelle capacità che consistono nel cogliere quegli indici sociali non verbali che modulano le relazioni interpersonali.,SPECIFICAZIONE 
,,"Il difficoltoso rapporto con gli altri, le difficoltà scolastiche, i continui rimproveri da parte delle
figure di autorità, il senso di inadeguatezza a contrastare tutto cio’ con le proprie capacità fanno sì che questi
bambini sviluppino un senso di demoralizzazione e di ansia, che accentua ulteriormente le loro difficoltà.",CAUSA
,,L’incapacità a frenare le proprie reazioni immediate li rende meno accettati dagli adulti e dai coetanei,CAUSA
,"La diversa percezione del tempo, l’incapacità a frenare le proprie reazioni immediate, la difficoltà a pianificare
e controllare i propri comportamenti fanno si che i bambini con ADHD manchino di quel “savoir faire sociale”
che consente di cogliere stimoli sociali, modulare le relazioni interpersonali, ricevere gratificazioni sociali ed
integrarsi socialmente con i coetanei e gli adulti. Ciò causa frequentemente senso di inadeguatezza, bassa
autostima, bassa soglia alle frustrazioni. Tali ""sensazioni"" rendono più difficile inibire la propria impulsività,
pianificare i propri comportamenti e stabilire relazioni sociali gratificanti.","La diversa percezione del tempo, l’incapacità a frenare le proprie reazioni immediate, la difficoltà a pianificare
e controllare i propri comportamenti fanno si che i bambini con ADHD manchino di quel “savoir faire sociale”
che consente di cogliere stimoli sociali, modulare le relazioni interpersonali, ricevere gratificazioni sociali ed
integrarsi socialmente con i coetanei e gli adulti. Ciò causa frequentemente senso di inadeguatezza, bassa
autostima, bassa soglia alle frustrazioni. ",CAUSA
,,"Tali ""sensazioni"" rendono più difficile inibire la propria impulsività,
pianificare i propri comportamenti e stabilire relazioni sociali gratificanti.",CAUSA
Il testo come descrive e argomenta gli interventi per gestire il comportamento di un alunno con ADHD in ambito scolastico?  ,"Il programma di trattamento deve prevedere consigli e supporto per genitori ed insegnanti e può comprendere interventi psicologici specifici . Sebbene la più ampia gamma di possibili interventi sia auspicabile, la mancata disponibilità di interventi psicoeducativi intensivi non deve essere causa di ritardo nell’inizio della terapia farmacologica, quando essa sia ritenuta utile e necessaria. Come per qualunque patologia, ogni operatore sanitario che abbia
formulato la diagnosi deve comunicare ai genitori o tutori legali, e discutere con loro, le diverse
strategie terapeutiche ed inviare, quando opportuno, il bambini ed i suoi genitori ai Centri di Alta
Specializzazione.",Il programma di trattamento deve prevedere consigli e supporto per genitori ed insegnanti ,SANCIRE 
,,e può comprendere interventi psicologici specifici ,POSSIBILITA 
,,"Sebbene la più ampia gamma di possibili interventi sia auspicabile,",SANCIRE 
,," la mancata disponibilità di interventi psicoeducativi intensivi non deve essere causa di ritardo nell’inizio della terapia farmacologica, quando essa sia ritenuta utile e necessaria. ",PRESCRIZIONE
